{
  "$schema": "https://json-schema.org/draft/2020-12/schema",
  "title": "ProposalApproveRequest",
  "description": "The input of proposal.approve, as \u00a726.1's table gives it: the canonical URI of the waiting proposal, and the fingerprint of the request the approver saw, which DSoR compares with the stored one (DSOR-APR-09; step 29's README, decision D1). The pattern is the specification's resourceUri; the /proposal/ part beside it is this tutorial's. Since step 41, the approval of a run also carries the run's fingerprint, its manifest_hash, and its totals per currency and per vendor, exactly as the approver was shown them, which DSoR compares with the run's own (DSOR-BAT-02a; step 41's README, decision D4).",
  "type": "object",
  "properties": {
    "proposal": {
      "$ref": "urn:dsor:schema:1.3:common#/$defs/resourceUri",
      "type": "string",
      "pattern": "^dsor://[^/]+/proposal/"
    },
    "payload_hash": {
      "$ref": "urn:dsor:schema:1.3:common#/$defs/hash",
      "type": "string",
      "maxLength": 200,
      "description": "The fingerprint of the stored request, sha256: and the hex digest of its RFC 8785 canonical JSON (DSOR-APR-02b)."
    },
    "manifest_hash": {
      "$ref": "urn:dsor:schema:1.3:common#/$defs/hash",
      "type": "string",
      "maxLength": 200,
      "description": "For a run only: the fingerprint of its lines in their order."
    },
    "totals": {
      "type": "array",
      "maxItems": 50,
      "items": {
        "$ref": "urn:dsor:schema:1.3:common#/$defs/money"
      },
      "description": "For a run only: its totals per currency, as proposal.schema.json's totals."
    },
    "vendor_totals": {
      "type": "array",
      "maxItems": 50,
      "items": {
        "type": "object",
        "properties": {
          "vendor": {
            "$ref": "urn:dsor:schema:1.3:common#/$defs/resourceUri",
            "type": "string",
            "pattern": "^dsor://[^/]+/vendor/"
          },
          "amount": {
            "$ref": "urn:dsor:schema:1.3:common#/$defs/money"
          }
        },
        "required": ["vendor", "amount"],
        "additionalProperties": false
      },
      "description": "For a run only: its totals per vendor and currency. This tutorial's own field: proposal.schema.json has none for the counterparty."
    }
  },
  "required": ["proposal", "payload_hash"],
  "additionalProperties": false
}
