{
  "proposal": "dsor://org_456/proposal/prop_00000000-0000-4000-8000-000000000029",
  "payload_hash": "sha256:0000000000000000000000000000000000000000000000000000000000000000",
  "manifest_hash": "sha256:0000000000000000000000000000000000000000000000000000000000000041",
  "totals": [{ "value": "40940.50", "currency": "USD" }],
  "vendor_totals": [
    {
      "vendor": "dsor://org_456/vendor/VENDOR-44",
      "amount": { "value": "40940.50", "currency": "USD" }
    }
  ]
}
